{"format": 1, "run_id": "review", "run_uid": "11b2938cff8c4f18a84ac80721c96f8c", "host_id": "host-1", "run_group": "review", "pid": 1, "start_ticks": 1, "argv": ["flow.py"], "cwd": "/work/review", "started_at": "2026-10-15T10:47:45+00:00", "stub": true, "preflight": {"policy": "off", "dropped": [], "substituted": [], "kept": [], "stopped": []}, "quota_caps": {}, "quota_rule": "", "max_workers": 4, "finished_at": "2026-10-15T10:47:45+00:00"}